review_status	review_disposition	candidate_parent_id	candidate_parent_name	current_parent_id	current_parent_name	expected_parent_rank	child_count	high	medium	low	span_range	evidence_needed	review_note	child_ids	child_names	skip_fact_ids	bridge_fact_ids
reviewed	same_parent_sibling_false_positive	title-q699964	Archduchy of Austria	title-q131964	Austrian Empire	Duchy	1	1	0	0	1804..1866	none_after_negative_review	Reviewed 2026-06-22: Gorizia and Gradisca was a Habsburg crown-land/littoral unit, not child-to-candidate parentage under the Archduchy of Austria.	title-q692946	Gorizia and Gradisca	fact-q692946-parent-q131964	fact-q699964-parent-q131964
reviewed	same_parent_sibling_false_positive	title-q693570	Duchy of Ferrara	title-q170174	Papal States	Duchy	1	1	0	0	1274..1791	none_after_negative_review	Reviewed 2026-06-22: Comtat Venaissin and Ferrara were separate papal territories, not child-to-candidate parentage.	title-q1122980	Comtat Venaissin	fact-q1122980-parent-q170174	fact-q693570-parent-q170174
reviewed	same_parent_sibling_false_positive	title-q625380	Eastern Hungarian Kingdom	title-q12560	Ottoman Empire	Kingdom	1	1	0	0	1516..1696	none_after_negative_review	Reviewed 2026-06-22: Prince-Bishopric of Montenegro is sourced as an Ottoman-vassal then independent Montenegrin theocracy, not child-to-candidate parentage under the Eastern Hungarian Kingdom.	title-q3324486	Prince-Bishopric of Montenegro	fact-q3324486-parent-q12560	fact-q625380-parent-q12560
reviewed	same_parent_sibling_false_positive	title-q1069959	Kingdom of Imereti	title-q34266	Russian Empire	Kingdom	1	1	0	0	1809..1917	none_after_negative_review	Reviewed 2026-06-22: Grand Duchy of Finland and Kingdom of Imereti were separate Russian imperial possessions, not child-to-candidate parentage.	title-q62633	Grand Duchy of Finland	fact-q62633-parent-q34266	fact-q1069959-parent-q34266
reviewed	same_parent_sibling_false_positive	title-q148499	Margraviate of Brandenburg	title-q12548	Holy Roman Empire	Duchy	1	1	0	0	1160..1806	none_after_negative_review	Reviewed 2026-06-22: sources identify Nassau and Brandenburg as separate Holy Roman Empire states, not child-to-candidate parentage.	title-q12817455	County of Nassau	fact-q12817455-parent-q12548	fact-q148499-parent-q12548
